{
  "analysis_id": "0192f6c4-8b00-7a00-8000-0000000000aa",
  "user_id": "usr_01JB7Q3K9W2F",
  "stage": "notes.guitar",
  "cache_key": "7ee5c9e6b0b59cabe354676dc2ec821e42fd970901eb2fb06d3f4ed55355915e",
  "inputs": {
    "stem": "u/usr_01JB7Q3K9W2F/a/0192f6c4-8b00-7a00-8000-0000000000aa/v1/stems/guitar.m4a"
  },
  "outputs": {
    "notes": "u/usr_01JB7Q3K9W2F/a/0192f6c4-8b00-7a00-8000-0000000000aa/v1/notes/guitar.json"
  },
  "params": {
    "onset_threshold": 0.5,
    "frame_threshold": 0.3,
    "min_note_ms": 58
  },
  "presigned": {
    "inputs": {
      "stem": "https://media.example.test/u/usr_01JB7Q3K9W2F/a/0192f6c4-8b00-7a00-8000-0000000000aa/v1/stems/guitar.m4a?X-Amz-Signature=fake"
    },
    "outputs": {
      "notes": "https://media.example.test/u/usr_01JB7Q3K9W2F/a/0192f6c4-8b00-7a00-8000-0000000000aa/v1/notes/guitar.json?X-Amz-Signature=fake"
    }
  },
  "callback": {
    "url": "https://api.example.test/internal/ml/callback",
    "nonce": "c0ffee00c0ffee00c0ffee00"
  }
}
